{
  "id": "168h_muscle_catalog",
  "version": "1.0.0",
  "scope": "Initial fitness illustration catalog, not exhaustive anatomical atlas; aggregates/regions explicitly labeled",
  "entries": [
    {
      "id": "muscle_pectoralis_major_l",
      "pair_id": "muscle_pectoralis_major",
      "side": "l",
      "anatomical_name": "Pectoralis major",
      "group": "chest",
      "representation": "muscle",
      "region": "muscle",
      "required": true,
      "deprecated": false
    },
    {
      "id": "muscle_pectoralis_major_r",
      "pair_id": "muscle_pectoralis_major",
      "side": "r",
      "anatomical_name": "Pectoralis major",
      "group": "chest",
      "representation": "muscle",
      "region": "muscle",
      "required": true,
      "deprecated": false
    },
    {
      "id": "muscle_deltoid_anterior_l",
      "pair_id": "muscle_deltoid_anterior",
      "side": "l",
      "anatomical_name": "Deltoid",
      "group": "shoulder",
      "representation": "region",
      "region": "anterior region",
      "required": true,
      "deprecated": false
    },
    {
      "id": "muscle_deltoid_anterior_r",
      "pair_id": "muscle_deltoid_anterior",
      "side": "r",
      "anatomical_name": "Deltoid",
      "group": "shoulder",
      "representation": "region",
      "region": "anterior region",
      "required": true,
      "deprecated": false
    },
    {
      "id": "muscle_deltoid_middle_l",
      "pair_id": "muscle_deltoid_middle",
      "side": "l",
      "anatomical_name": "Deltoid",
      "group": "shoulder",
      "representation": "region",
      "region": "middle region",
      "required": true,
      "deprecated": false
    },
    {
      "id": "muscle_deltoid_middle_r",
      "pair_id": "muscle_deltoid_middle",
      "side": "r",
      "anatomical_name": "Deltoid",
      "group": "shoulder",
      "representation": "region",
      "region": "middle region",
      "required": true,
      "deprecated": false
    },
    {
      "id": "muscle_deltoid_posterior_l",
      "pair_id": "muscle_deltoid_posterior",
      "side": "l",
      "anatomical_name": "Deltoid",
      "group": "shoulder",
      "representation": "region",
      "region": "posterior region",
      "required": true,
      "deprecated": false
    },
    {
      "id": "muscle_deltoid_posterior_r",
      "pair_id": "muscle_deltoid_posterior",
      "side": "r",
      "anatomical_name": "Deltoid",
      "group": "shoulder",
      "representation": "region",
      "region": "posterior region",
      "required": true,
      "deprecated": false
    },
    {
      "id": "muscle_latissimus_dorsi_l",
      "pair_id": "muscle_latissimus_dorsi",
      "side": "l",
      "anatomical_name": "Latissimus dorsi",
      "group": "back",
      "representation": "muscle",
      "region": "muscle",
      "required": true,
      "deprecated": false
    },
    {
      "id": "muscle_latissimus_dorsi_r",
      "pair_id": "muscle_latissimus_dorsi",
      "side": "r",
      "anatomical_name": "Latissimus dorsi",
      "group": "back",
      "representation": "muscle",
      "region": "muscle",
      "required": true,
      "deprecated": false
    },
    {
      "id": "muscle_trapezius_upper_l",
      "pair_id": "muscle_trapezius_upper",
      "side": "l",
      "anatomical_name": "Trapezius",
      "group": "back",
      "representation": "region",
      "region": "upper region",
      "required": true,
      "deprecated": false
    },
    {
      "id": "muscle_trapezius_upper_r",
      "pair_id": "muscle_trapezius_upper",
      "side": "r",
      "anatomical_name": "Trapezius",
      "group": "back",
      "representation": "region",
      "region": "upper region",
      "required": true,
      "deprecated": false
    },
    {
      "id": "muscle_trapezius_middle_l",
      "pair_id": "muscle_trapezius_middle",
      "side": "l",
      "anatomical_name": "Trapezius",
      "group": "back",
      "representation": "region",
      "region": "middle region",
      "required": true,
      "deprecated": false
    },
    {
      "id": "muscle_trapezius_middle_r",
      "pair_id": "muscle_trapezius_middle",
      "side": "r",
      "anatomical_name": "Trapezius",
      "group": "back",
      "representation": "region",
      "region": "middle region",
      "required": true,
      "deprecated": false
    },
    {
      "id": "muscle_trapezius_lower_l",
      "pair_id": "muscle_trapezius_lower",
      "side": "l",
      "anatomical_name": "Trapezius",
      "group": "back",
      "representation": "region",
      "region": "lower region",
      "required": true,
      "deprecated": false
    },
    {
      "id": "muscle_trapezius_lower_r",
      "pair_id": "muscle_trapezius_lower",
      "side": "r",
      "anatomical_name": "Trapezius",
      "group": "back",
      "representation": "region",
      "region": "lower region",
      "required": true,
      "deprecated": false
    },
    {
      "id": "muscle_rhomboid_major_l",
      "pair_id": "muscle_rhomboid_major",
      "side": "l",
      "anatomical_name": "Rhomboid major",
      "group": "back",
      "representation": "muscle",
      "region": "muscle",
      "required": true,
      "deprecated": false
    },
    {
      "id": "muscle_rhomboid_major_r",
      "pair_id": "muscle_rhomboid_major",
      "side": "r",
      "anatomical_name": "Rhomboid major",
      "group": "back",
      "representation": "muscle",
      "region": "muscle",
      "required": true,
      "deprecated": false
    },
    {
      "id": "muscle_teres_major_l",
      "pair_id": "muscle_teres_major",
      "side": "l",
      "anatomical_name": "Teres major",
      "group": "back",
      "representation": "muscle",
      "region": "muscle",
      "required": true,
      "deprecated": false
    },
    {
      "id": "muscle_teres_major_r",
      "pair_id": "muscle_teres_major",
      "side": "r",
      "anatomical_name": "Teres major",
      "group": "back",
      "representation": "muscle",
      "region": "muscle",
      "required": true,
      "deprecated": false
    },
    {
      "id": "muscle_biceps_brachii_l",
      "pair_id": "muscle_biceps_brachii",
      "side": "l",
      "anatomical_name": "Biceps brachii",
      "group": "upper_arm",
      "representation": "muscle",
      "region": "muscle",
      "required": true,
      "deprecated": false
    },
    {
      "id": "muscle_biceps_brachii_r",
      "pair_id": "muscle_biceps_brachii",
      "side": "r",
      "anatomical_name": "Biceps brachii",
      "group": "upper_arm",
      "representation": "muscle",
      "region": "muscle",
      "required": true,
      "deprecated": false
    },
    {
      "id": "muscle_brachialis_l",
      "pair_id": "muscle_brachialis",
      "side": "l",
      "anatomical_name": "Brachialis",
      "group": "upper_arm",
      "representation": "muscle",
      "region": "muscle",
      "required": true,
      "deprecated": false
    },
    {
      "id": "muscle_brachialis_r",
      "pair_id": "muscle_brachialis",
      "side": "r",
      "anatomical_name": "Brachialis",
      "group": "upper_arm",
      "representation": "muscle",
      "region": "muscle",
      "required": true,
      "deprecated": false
    },
    {
      "id": "muscle_brachioradialis_l",
      "pair_id": "muscle_brachioradialis",
      "side": "l",
      "anatomical_name": "Brachioradialis",
      "group": "forearm",
      "representation": "muscle",
      "region": "muscle",
      "required": true,
      "deprecated": false
    },
    {
      "id": "muscle_brachioradialis_r",
      "pair_id": "muscle_brachioradialis",
      "side": "r",
      "anatomical_name": "Brachioradialis",
      "group": "forearm",
      "representation": "muscle",
      "region": "muscle",
      "required": true,
      "deprecated": false
    },
    {
      "id": "muscle_triceps_brachii_l",
      "pair_id": "muscle_triceps_brachii",
      "side": "l",
      "anatomical_name": "Triceps brachii",
      "group": "upper_arm",
      "representation": "muscle",
      "region": "muscle",
      "required": true,
      "deprecated": false
    },
    {
      "id": "muscle_triceps_brachii_r",
      "pair_id": "muscle_triceps_brachii",
      "side": "r",
      "anatomical_name": "Triceps brachii",
      "group": "upper_arm",
      "representation": "muscle",
      "region": "muscle",
      "required": true,
      "deprecated": false
    },
    {
      "id": "muscle_flexor_carpi_radialis_l",
      "pair_id": "muscle_flexor_carpi_radialis",
      "side": "l",
      "anatomical_name": "Flexor carpi radialis",
      "group": "forearm",
      "representation": "muscle",
      "region": "muscle",
      "required": true,
      "deprecated": false
    },
    {
      "id": "muscle_flexor_carpi_radialis_r",
      "pair_id": "muscle_flexor_carpi_radialis",
      "side": "r",
      "anatomical_name": "Flexor carpi radialis",
      "group": "forearm",
      "representation": "muscle",
      "region": "muscle",
      "required": true,
      "deprecated": false
    },
    {
      "id": "muscle_flexor_carpi_ulnaris_l",
      "pair_id": "muscle_flexor_carpi_ulnaris",
      "side": "l",
      "anatomical_name": "Flexor carpi ulnaris",
      "group": "forearm",
      "representation": "muscle",
      "region": "muscle",
      "required": true,
      "deprecated": false
    },
    {
      "id": "muscle_flexor_carpi_ulnaris_r",
      "pair_id": "muscle_flexor_carpi_ulnaris",
      "side": "r",
      "anatomical_name": "Flexor carpi ulnaris",
      "group": "forearm",
      "representation": "muscle",
      "region": "muscle",
      "required": true,
      "deprecated": false
    },
    {
      "id": "muscle_extensor_carpi_radialis_longus_l",
      "pair_id": "muscle_extensor_carpi_radialis_longus",
      "side": "l",
      "anatomical_name": "Extensor carpi radialis longus",
      "group": "forearm",
      "representation": "muscle",
      "region": "muscle",
      "required": true,
      "deprecated": false
    },
    {